{
  "webImage": {
    "repository": "ghcr.io/optiplex331/halligalli-bossyang-web",
    "digest": "sha256:234cc6b4a30e0e782bd9fa04ee42a1d3eea37f70b348fbb90ca9d91373de3a97"
  },
  "apiImage": {
    "repository": "ghcr.io/optiplex331/halligalli-bossyang-api",
    "digest": "sha256:7af9f4bda594f2426b72ef6a0f21f3b6020668f95dd94eb756ed32a17f3063fd"
  },
  "redisImage": {
    "repository": "redis",
    "digest": "sha256:62b5498c91778f738f0efbf0a6fd5b434011235a3e7b5f2ed4a2c0c63bb1c786"
  },
  "replicas": {
    "web": 2,
    "api": 2
  },
  "resources": {
    "web": {
      "requests": {
        "cpu": "50m",
        "memory": "64Mi"
      },
      "limits": {
        "cpu": "250m",
        "memory": "128Mi"
      }
    },
    "api": {
      "requests": {
        "cpu": "100m",
        "memory": "128Mi"
      },
      "limits": {
        "cpu": "500m",
        "memory": "256Mi"
      }
    },
    "redis": {
      "requests": {
        "cpu": "50m",
        "memory": "64Mi"
      },
      "limits": {
        "cpu": "250m",
        "memory": "256Mi"
      }
    }
  },
  "redisAuthSecretName": "halligalli-redis-auth"
}
